question_id,question,options,correct_answer,llama_answer,llama_correct,llama_explicit,llama_implicit,llama_logical,qwen_answer,qwen_correct,qwen_explicit,qwen_implicit,qwen_logical,notes
14,The male insects in a population are treated to prevent sperm production. Would this reduce this insect population?,,C,C,YES,"1. Producing sperm is essential for fertilizing eggs.
2. Preventing male insects from producing sperm prevents fertilization.
3. Females would not be able to reproduce.
4. Reduced reproduction causes population decline.","1. Female insects require fertilized eggs to reproduce.
2. Reduced reproduction over time leads to population decline.","1. If a biological process essential for reproduction is disrupted, population size will/may decline over time.",C,YES,"1. Male insect unable to produce sperm, are unable to contribute genetic material to offspring
2. Population decline can result from reduction in successful matings and offspring production.","1. Male genetic contribution is necessary for producing offspring.
2. Reduced offspring production leads to smaller future populations.",1. Reduced reproductive success leads to population decline across generations.,
15,"On Earth, water can be a solid, a liquid, or a gas. Which energy source has the greatest influence on the state of matter of water?",,A,A,YES,"1. The sun is the primary source of heat and light driving Earth’s climate and weather.
2. The sun’s energy causes water to evaporate.
3. Evaporation and precipitation are part of the water cycle.
4. The water cycle is influenced by the sun’s energy.","1. Heat influences the state of matter of water.
2. Evaporation involves water changing from liquid to gas.
3. The primary driver of water state changes has the greatest influence on water’s states of matter.
4. Wind, ocean currents, and Earth’s core have less influence on water’s state than the sun.","If an energy source drives the processes responsible for changes in water’s state, then it has the greatest influence on the state of matter of water.",A,YES,"1. The sun provides the heat necessary for evaporation.
2 .Evaporation changes water from liquid to gas.
3. The sun contributes to water freezing/cooling to its freezing point.
4. Wind, ocean currents, and Earth’s metal core play roles in the water cycle.
5. These other factors do not have as direct and significant an impact as the sun.","1. Changes in water’s state require energy transfer.
2. Heat is a primary factor determining whether water is solid, liquid, or gas.
3. The most direct and significant energy source has the greatest influence on water’s state of matter.","If an energy source directly drives phase changes in water, it has the strongest influence on water’s state of matter.",
16,A ship leaks a large amount of oil near a coastal area. Which statement describes how the oil most likely will affect the coastal habitat?,,B,C,NO,"Oil spills can block sunlight from reaching aquatic plants.
Aquatic plants require sunlight for photosynthesis.
Reduced sunlight decreases plant growth and may kill plants.
Water plants would be exposed to less sunlight after an oil spill.","1. Oil floating on water reduces light penetration.
2. Reduced photosynthesis harms aquatic ecosystems.
3. Increased sunlight exposure is inconsistent with oil blocking sunlight.","If an environmental factor blocks sunlight required for photosynthesis, aquatic plant growth will decrease.",B,YES,"1. Oil can coat water bird feathers.
2. Oil-coated feathers become heavy and difficult to use for flight.
3. Difficulty flying threatens bird survival and reproduction.
4. Oil spills do not increase fish reproduction.
5. Oil spills do not increase sunlight exposure for water plants.
6. Oil spills do not provide extra nutrients to coastal plants.","1. Water birds rely on functional wings for survival.
2. Oil contamination harms animal mobility.
3. Oil spills negatively affect coastal ecosystems.","If oil coats bird feathers, water birds will be unable to use their wings effectively.",
17,A chemical property of a mineral is evident if the mineral,,2,?,NO,"Bubbling when acid is placed on a mineral indicates a chemical reaction.
Reacting with another substance is a chemical property.
Acid reacting with the mineral is evidence of a chemical property.","Bubbling is caused by formation/release of a new substance (e.g. gas).
Chemical reactions reveal chemical properties.
The other answer options describe physical rather than chemical properties.","If a substance reacts chemically with another substance, the observed behavior indicates a chemical property.",?,NO,"Bubbling indicates a chemical reaction.
The bubbling is caused by release of a gas such as carbon dioxide.
Carbonates are examples of minerals showing this behavior.
The other options describe physical properties rather than chemical properties.","Production of gas is evidence of chemical change.
Chemical properties are identified through chemical reactions.","If interaction with another substance produces a chemical reaction, the observed characteristic is a chemical property.",
18,"One evening as it is getting dark, Alex sits on the front porch and watches the sun slowly disappear behind the neighbor's house across the street. Which explains this observation?",,D,D,YES,"The observation is caused by Earth’s rotation.
Earth rotates from west to east.
The sun appears to move from east to west across the sky.
Earth’s rotation causes the apparent motion of the sun.
The sun appears to disappear behind the neighbor’s house as Earth rotates.","The sun is not actually moving around Earth each day.
Apparent motion in the sky can result from observer motion.
Earth’s rotation changes the observer’s orientation relative to the sun over time.","If Earth rotates while an observer remains on its surface, celestial objects will appear to move across the sky.",D,YES,"Earth rotates on its axis from west to east.
The sun appears to rise in the east and set in the west.
Earth’s rotation makes the sun appear to move behind objects in the sky.
The apparent movement causes the sun to disappear behind the neighbor’s house.","The sun’s apparent motion is observational rather than actual local movement around Earth.
Objects on Earth can obstruct the observer’s line of sight to the sun.
Rotation of the observer’s frame of reference changes perceived positions of celestial objects.","If an observer rotates with Earth, the sun will appear to move across the sky relative to stationary objects on Earth.",
19,A toothpaste commercial states that a brand of toothpaste has a higher concentration of fluoride than any other toothpaste available. The commercial is most likely inferring that the advertised toothpaste,,C,B,NO,"The commercial claims the toothpaste has a higher fluoride concentration than competitors.
Higher fluoride concentration is intended to suggest the toothpaste is more effective.
Dentists are viewed as authorities on oral health.
Marketing often uses professional endorsement to build trust.
The advertisement implies the toothpaste is recommended by dentists.","Consumers associate fluoride concentration with toothpaste quality.
Products perceived as more effective are more likely to be recommended by professionals.
Professional endorsement increases consumer trust.
Fluoride concentration is being treated as evidence of professional approval.","If a product contains a feature associated with effectiveness, advertisements may imply professional endorsement.",C,YES,"Fluoride strengthens tooth enamel.
Fluoride helps prevent cavities.
Fluoride is important in dental hygiene products.
Higher fluoride concentration suggests better protection against tooth decay and gum disease.
The commercial implies the toothpaste promotes good dental hygiene.","Better cavity prevention contributes to good dental hygiene.
Consumers associate fluoride with dental health benefits.
Greater fluoride concentration is interpreted as greater effectiveness.","If a product contains more of a beneficial health-related ingredient, it is inferred to provide greater health benefits.",
20,What do cells break down to produce energy?,,A,A,YES,"Cells break down food molecules to produce energy.
Food molecules include carbohydrates, fats, and proteins.
Cellular respiration breaks food molecules into simpler substances.
Cellular respiration releases energy used by cells.","Energy for cellular activities comes from breakdown of nutrients.
Food contains stored chemical energy.
Cellular respiration is the mechanism cells use to access usable energy.
Cells obtain usable energy from food rather than from water, chlorophyll, or carbon dioxide.","If cells obtain energy by breaking down a substance during cellular respiration, that substance is used to produce energy.",A,YES,"Cells break down food to produce energy.
Nutrients from food are broken down into simpler molecules.
Cellular respiration generates ATP.
ATP is the energy currency of cells.","ATP is required for cellular functions.
Food contains nutrients usable for energy production.
Cellular respiration converts chemical energy from food into usable cellular energy.
Cells obtain usable energy from food rather than from water, chlorophyll, or carbon dioxide.","If a substance is processed in cellular respiration to generate ATP, it serves as an energy source for cells.",
,,,,,,,,,,,,,,
,,,,,,,,,,,,,,
,,,,,,,,,,,,,,
,,,,,,,,,,,,,,
,,,,,,,,,,,,,,
,,,,,,,,,,,,,,
,,,,,,,,,,,,,,
,,,,,,,,,,,,,,
,,,,,,,,,,,,,,
