question_id,question,correct_answer,llama_answer,llama_explanation,llama_correct,qwen_answer,qwen_explanation,qwen_correct,llama_annotations,qwen_annotations
71,"In the carbon cycle, carbon moves from reservoir to reservoir as various organic and inorganic processes occur on Earth. Only a small percentage of the global carbon is moved in this cycle each year. The remaining carbon is stored in these reservoirs. Which reservoir contains the greatest amount of stored carbon?",D,D,"The deep ocean is the correct answer because it contains the largest reservoir of stored carbon on Earth. This is due to the fact that the deep ocean is a massive body of water that covers over 70% of the planet's surface, and it has a high capacity to store carbon in the form of dissolved inorganic carbon and organic carbon. Additionally, the deep ocean is a relatively stable environment with slow rates of carbon exchange, which allows it to store carbon for long periods of time. As a result, the deep ocean contains the greatest amount of stored carbon compared to other reservoirs such as the atmosphere",YES,C,"The deep ocean contains the greatest amount of stored carbon because it holds vast quantities of dissolved inorganic carbon and organic matter from dead organisms that sink to the bottom. This reservoir is significantly larger than the others, making it the primary long-term storage for carbon on Earth.",NO,"The deep ocean covers most of Earth's surface and holds a large carbon reservoir.
It stores carbon as dissolved inorganic and organic carbon.
Slow rates of carbon exchange allow the deep ocean to store carbon for long periods.","The deep ocean holds vast quantities of dissolved inorganic carbon.
It also stores organic matter from dead organisms that sink to the bottom.
This makes the deep ocean the primary long-term carbon reservoir."
72,"New engine technology has helped cars get more mileage per gallon of gas. Since gasoline comes from oil, this technology will affect the world supply of oil by",D,D,"The new engine technology that helps cars get more mileage per gallon of gas means that cars will use less gasoline overall. Since gasoline comes from oil, this reduction in gasoline consumption will lead to a slower depletion of the world's oil supply. As a result, the time that oil will be available for people to use will be extended, as it will take longer to consume the existing oil reserves.",YES,D,"New engine technology that improves fuel efficiency means cars consume less gasoline per mile driven. With reduced demand for gasoline, there is less pressure to rapidly increase oil production and exploration. This implies that existing oil reserves can last longer, extending the period during which oil remains a viable resource. Therefore, option D correctly reflects the impact of improved fuel efficiency on oil availability.",YES,"More fuel-efficient engines mean cars use less gasoline overall.
Reduced gasoline consumption slows the depletion of oil reserves.
This extends how long existing oil supplies will last.","Improved fuel efficiency means cars consume less gasoline per mile.
Reduced gasoline demand lessens pressure to rapidly extract more oil.
This allows existing oil reserves to last longer."
73,Corn is widely being used in the United States to make ethanol for use in automobile fuel. How might the overproduction of corn negatively affect the environment?,A,C,"The correct answer is C) increasing the greenhouse effect. This is because the production of ethanol from corn requires the use of fertilizers, pesticides, and other chemicals that contribute to greenhouse gas emissions. Additionally, the process of growing and harvesting corn for ethanol production can lead to deforestation and habitat destruction, further exacerbating the greenhouse effect. The increased demand for corn has also led to the clearing of natural habitats, such as forests and wetlands, which are important carbon sinks. Therefore, the overproduction of corn for ethanol can contribute to an increase in the greenhouse effect, which is a major environmental concern",NO,A,"The overproduction of corn can lead to decreasing soil fertility as intensive farming practices may deplete nutrients and increase erosion. This makes option A the most accurate choice among the given options. While increased corn production could potentially contribute to the greenhouse effect and carbon dioxide emissions, these effects are more directly related to the burning of ethanol rather than the agricultural practices themselves. Decreasing oil transportation is not a negative environmental impact of corn overproduction.",YES,"Ethanol production from corn requires fertilizers, pesticides, and other chemicals.
Growing and harvesting corn for ethanol can lead to deforestation and habitat destruction.
Clearing forests and wetlands removes important carbon sinks.","Intensive corn farming can deplete soil nutrients.
Intensive farming also increases soil erosion.
Greenhouse gas effects are more directly tied to burning ethanol than to growing the corn itself."
74,A company is designing a new laptop computer. The computer must not exceed a certain weight. Which of the following is the most likely reason to have a weight restriction for the computer?,C,C,"The correct answer is C) to make it easier to transport the computer. This is because a weight restriction is likely in place to ensure that the laptop can be easily carried by a user, which is a common scenario. The weight of the laptop would impact its portability and usability, making it a crucial factor in its design. The other options do not directly relate to the weight of the laptop and its impact on its intended use. 

In particular, option A is incorrect because testing a prototype is not directly related to the weight of the laptop. Option B is also incorrect because reducing the cost of",YES,C,"The most likely reason to have a weight restriction for the computer is C) to make it easier to transport the computer. Laptop computers are often used on-the-go, and lighter devices are generally more convenient for users to carry around. This can improve user experience and satisfaction, as well as potentially increase sales and market appeal. Weight restrictions can help ensure that the product meets consumer expectations for portability without compromising on necessary features or performance.",YES,"A weight restriction ensures the laptop can be easily carried by users.
Weight directly affects a laptop's portability and usability.
Portability is a crucial factor in a laptop's design.","Laptops are often used on the go, so lighter devices are more convenient to carry.
Weight restrictions help meet consumer expectations for portability.
This can improve user satisfaction and market appeal without sacrificing performance."
75,"The heart, blood vessels, kidneys, and bladder working together are best described as",D,D,"This question requires an understanding of basic biology terminology. A system is a group of organs that work together to perform a specific function or set of functions. In this case, the heart, blood vessels, kidneys, and bladder are all organs that work together to circulate blood, filter waste, and regulate fluid balance in the body. This is a clear example of a system, as each organ has a specific role and they all work together to achieve a common goal.

In contrast, a cell (A) is the basic structural and functional unit of living organisms, and it is much smaller than the organs",YES,D,"The heart, blood vessels, kidneys, and bladder working together form a system because they coordinate to perform specific functions related to circulation, filtration, and excretion. Each component has a specialized role, but their combined function is to maintain homeostasis and support the body's overall health, which is characteristic of a biological system.",YES,"A system is a group of organs that work together toward a common function.
The heart, blood vessels, kidneys, and bladder circulate blood, filter waste, and regulate fluid balance.
A cell is a much smaller structural and functional unit than an organ.","The heart, blood vessels, kidneys, and bladder coordinate circulation, filtration, and excretion.
Each organ has a specialized role within this coordinated function.
Their combined function maintains homeostasis, which is characteristic of a biological system."
76,Which property of a mineral can be determined just by looking at it?,A,A,"The question asks for a property of a mineral that can be determined by simply looking at it. Luster is a property that can be observed by looking at a mineral, as it refers to the way light reflects off the surface of the mineral. It can be described as metallic, glassy, dull, or other types, and can be determined by visual inspection. The other options, mass and weight, are not properties that can be determined by looking at a mineral, as they require measurement. Hardness is a property that requires a scratch test to determine, which involves applying pressure, not just visual",YES,A,"Luster is the property of a mineral that can be determined just by looking at it. It refers to how the mineral reflects light and can appear shiny or dull. Mass and weight require measurement tools to determine, and hardness typically requires scratching tests or comparisons with other minerals to assess accurately.",YES,"Luster describes how light reflects off a mineral's surface.
Luster can be visually classified as metallic, glassy, dull, or other types.
Mass and weight require measurement rather than visual inspection.
Hardness requires a scratch test rather than visual inspection.","Luster refers to how a mineral reflects light and can appear shiny or dull.
Mass and weight require measurement tools to determine.
Hardness typically requires scratch tests or comparisons with other minerals."
77,Cells are the basic unit of structure and function in all living organisms. Which describes the greatest difference between the cells of a baby gorilla and the cells of an adult gorilla?,A,D,"The correct answer is D because as an organism grows and develops, its cells become more specialized and complex. In the case of a baby gorilla, its cells are more general and undifferentiated, whereas the cells of an adult gorilla have undergone differentiation to perform specific functions. This means that the adult gorilla has a greater variety of cell types, such as muscle cells, nerve cells, and blood cells, whereas the baby gorilla's cells are more similar in structure and function. Therefore, the greatest difference between the cells of a baby gorilla and the cells of an adult gorilla is",NO,D,"The adult gorilla has different types of cells than the baby because during growth and development, the cells differentiate into various specialized types necessary for the adult's larger size and more complex functions. Baby gorillas have cells that can develop into any type needed for growth, while adult cells are already specialized for specific functions like muscle, nerve, or skin cells. This differentiation is a key aspect of maturation and does not involve changes in cell count, complexity, or size as the gorilla grows from a baby to an adult.",NO,"As an organism grows, its cells become more specialized and complex.
A baby gorilla's cells are largely undifferentiated and general.
An adult gorilla has a greater variety of differentiated cell types, such as muscle, nerve, and blood cells.","Baby gorilla cells can develop into whatever cell type is needed for growth.
Adult gorilla cells are already specialized for functions like muscle, nerve, or skin.
This differentiation is a key aspect of maturation rather than a change in cell count or size."
78,Giant redwood trees change energy from one form to another. How is energy changed by the trees?,B,B,"The correct answer is B because giant redwood trees undergo photosynthesis, a process where they use energy from the sun (solar energy) to convert carbon dioxide and water into glucose and oxygen. This process involves changing the energy from one form (solar energy) to another (chemical energy), which is stored in the glucose. This stored energy can then be used by the tree for growth and other biological processes.",YES,B,"Giant redwood trees primarily capture solar energy through their leaves and convert it into chemical energy stored in glucose during photosynthesis. This process changes solar energy into chemical energy, making option B the correct answer.",YES,"Redwood trees use solar energy to convert carbon dioxide and water into glucose and oxygen.
This process changes solar energy into chemical energy.
The chemical energy is stored in glucose for growth and other processes.","Redwood trees capture solar energy through their leaves during photosynthesis.
Photosynthesis converts solar energy into chemical energy stored in glucose."
79,"According to a pH scale, which pH would be the strongest acid?",A,A,"The pH scale is used to measure the acidity or basicity of a solution. A pH of 7 is considered neutral, while a pH below 7 is acidic and a pH above 7 is basic. The lower the pH value, the stronger the acid. 

In this case, option A) 3 has the lowest pH value, which means it is the strongest acid. This is because it is farthest from the neutral pH of 7, indicating a higher concentration of hydrogen ions, which is a characteristic of strong acids.",YES,A,"The pH scale ranges from 0 to 14, with 7 being neutral. Values below 7 indicate acidity, with lower numbers representing stronger acids. Therefore, a pH of 3 would be the strongest acid among the given options.",YES,"A pH of 7 is neutral, and values below 7 indicate acidity.
The lower the pH value, the stronger the acid.
A pH of 3 is farthest from neutral among the given options, indicating a higher concentration of hydrogen ions.","The pH scale ranges from 0 to 14, with 7 being neutral.
Lower pH values below 7 represent stronger acids.
A pH of 3 is the strongest acid among the given options."
80,An old T-shirt can be ripped into smaller pieces and used as rags. An empty milk jug can be used to water houseplants. Both of these are examples of how,D,D,"The correct answer is D because the question describes two scenarios where everyday materials are being reused for a different purpose. In the first scenario, an old T-shirt is ripped into smaller pieces and used as rags, and in the second scenario, an empty milk jug is used to water houseplants. Both examples demonstrate that everyday materials can be reused, rather than being discarded or replaced. This is the key idea being conveyed in the question, making option D the correct answer.",YES,D,"The correct answer is D. Everyday materials can be reused. This option best captures the essence of repurposing old T-shirts into rags and an empty milk jug into a watering tool. It emphasizes the practicality and sustainability of reusing items rather than discarding them, which aligns with the examples given. Options A, B, and C do not fully encompass the main idea presented in the question.",YES,"An old T-shirt can be reused as rags instead of discarded.
An empty milk jug can be reused to water houseplants.
Both examples show that everyday materials can be reused for a different purpose.","Ripping a T-shirt into rags and reusing a milk jug both repurpose everyday materials.
This repurposing avoids discarding items that still have practical use.
The examples emphasize the practicality and sustainability of reuse."
81,An ice cube placed in sunlight melts quickly. Which BEST explains this event?,B,B,"The correct answer is B because the Sun's energy, in the form of heat, causes the ice cube to melt quickly. The Sun's heat is transferred to the ice cube, increasing its temperature and causing the ice to change from a solid to a liquid state. This is a fundamental concept in physics, where heat energy is transferred from a source (in this case, the Sun) to a substance (the ice cube), causing a change in its state. The other options do not directly explain why the ice cube melts quickly in sunlight.",YES,B,"The Sun makes heat, which is the best explanation for why an ice cube placed in sunlight melts quickly. The heat from the Sun increases the kinetic energy of the water molecules in the ice, causing them to move faster and eventually break free from the rigid structure of the ice, turning it into liquid water. This process is known as melting.",YES,"The Sun's energy transfers heat to the ice cube.
This heat increases the ice cube's temperature.
The added heat causes the ice to change from solid to liquid.","Heat from the Sun increases the kinetic energy of water molecules in the ice.
Faster-moving molecules break free from the ice's rigid structure.
This breakdown of structure is the process of melting."
82,"A ""widow's peak"" hairline in humans is coded by the dominant allele W. A straight hairline is coded by the recessive allele w. A man with a homozygous dominant WW produces a zygote with a woman with a heterozygous dominant Ww for the trait. Which allele combinations could occur in the zygote?",B,B,"The correct answer is B because when a man with a homozygous dominant WW genotype (meaning he has two dominant alleles) mates with a woman with a heterozygous dominant Ww genotype (meaning she has one dominant and one recessive allele), the possible genotypes of their offspring are determined by the laws of Mendelian inheritance.

In this case, the man can only contribute a dominant W allele to the offspring, while the woman can contribute either a dominant W or a recessive w allele. Therefore, the possible genotypes of the offspring are WW (if the woman contributes a W",YES,B,"The father has a homozygous dominant genotype (WW), meaning he can only contribute a W allele to any zygote. The mother has a heterozygous genotype (Ww), which means she can contribute either a W or a w allele. Therefore, the possible allele combinations in the zygote are WW (if the mother contributes W) or Ww (if the mother contributes w). Thus, the correct answer includes both WW and Ww combinations.",YES,"A father with genotype WW can only contribute a dominant W allele.
A mother with genotype Ww can contribute either a W or a w allele.
The possible zygote genotypes are WW or Ww.","The father's homozygous WW genotype means he can only pass on a W allele.
The mother's heterozygous Ww genotype means she can pass on either W or w.
The zygote can therefore be WW or Ww."
83,Which of these is never found in prokaryotic cells?,D,D,"Prokaryotic cells are a type of cell that lacks a true nucleus and other membrane-bound organelles. The nucleus is a membrane-bound organelle that contains the cell's genetic material, and it is a defining characteristic of eukaryotic cells, not prokaryotic cells. Therefore, a nucleus is never found in prokaryotic cells.",YES,D,"Prokaryotic cells, such as bacteria, lack a true nucleus and other membrane-bound organelles. The nucleus is a defining characteristic of eukaryotic cells, which means it is never found in prokaryotic cells. In contrast, cell membranes, ribosomes, and cell walls are all present in prokaryotic cells.",YES,"Prokaryotic cells lack a true nucleus and other membrane-bound organelles.
A nucleus is a membrane-bound organelle containing genetic material.
The nucleus is a defining feature of eukaryotic, not prokaryotic, cells.","Prokaryotic cells such as bacteria lack a true nucleus.
The nucleus is a defining feature of eukaryotic cells.
Cell membranes, ribosomes, and cell walls are present in prokaryotic cells."
84,What do earthquakes tell scientists about the history of the planet?,B,B,"The correct answer is B because earthquakes provide evidence of plate tectonics, which is the movement of the Earth's lithosphere. The study of earthquakes helps scientists understand the process of plate movement, including the creation of mountains, volcanoes, and oceanic trenches. This movement has been occurring for millions of years, shaping the Earth's surface and resulting in the continents' current positions. Therefore, earthquakes offer valuable insights into the history of the planet, particularly in terms of the movement of the continents.",YES,B,"Earthquakes provide evidence for plate tectonics, which explains that the Earth's crust is divided into large, rigid plates that move relative to each other. Seismic waves from earthquakes help scientists map the structure of these plates and understand their movements over geological time scales. This movement of plates can cause the formation and collision of continents, mountain building, and the creation of oceanic trenches. Therefore, earthquakes are crucial for understanding how the continents have moved and changed positions over time, supporting option B.",YES,"Earthquakes provide evidence of plate tectonics, the movement of Earth's lithosphere.
This movement creates mountains, volcanoes, and oceanic trenches.
Plate movement over millions of years has shaped the continents' current positions.","Earthquakes provide evidence that Earth's crust is divided into rigid moving plates.
Seismic waves help scientists map plate structure and movement over geological time.
This plate movement causes continent collision, mountain building, and oceanic trench formation."
85,The source of energy for the Earth's water cycle is the,B,B,"The correct answer is B) Sun's radiation.

The Earth's water cycle is the continuous process by which water is circulated between the Earth's oceans, atmosphere, and land. The primary source of energy for this cycle is the Sun's radiation, which heats the surface of the Earth and causes water to evaporate from the oceans, lakes, and rivers into the atmosphere. This process is known as evaporation. The Sun's radiation also drives the movement of air in the atmosphere, which in turn drives the formation of clouds and precipitation. Therefore, the Sun's radiation is the key driver of the Earth",YES,B,"The Sun's radiation is the correct answer because it provides the necessary energy to heat water on the Earth's surface, causing it to evaporate and drive the water cycle. Wind, while important for moving water vapor, does not provide the energy. Earth's radiation primarily cools the planet and does not initiate evaporation. Sun's gravity affects the tides but does not drive the water cycle.",YES,"The Sun's radiation heats water at the Earth's surface, causing evaporation.
Evaporated water enters the atmosphere and forms clouds.
The Sun's radiation also drives atmospheric air movement that produces precipitation.","The Sun's radiation heats surface water and causes it to evaporate.
Wind moves water vapor but does not supply the energy that drives the cycle.
Earth's own radiation cools the planet rather than driving evaporation."
86,Stars are organized into patterns called constellations. One constellation is named Leo. Which statement best explains why Leo appears in different areas of the sky throughout the year?,A,A,"The correct answer is A) Earth revolves around the sun.

The reason Leo appears in different areas of the sky throughout the year is because the Earth is rotating on its axis and revolving around the sun. As the Earth moves around the sun, different constellations become visible in the night sky, creating the illusion that they are changing positions. This is known as the Earth's orbit around the sun, which causes the constellations to appear to shift in the sky over the course of a year.",YES,A,"Earth revolves around the sun, which causes the apparent movement of stars and constellations across the night sky throughout the year. As Earth orbits the sun, our perspective changes, making it seem as though the constellations move to different areas of the sky. This orbital motion is the primary reason for the changing positions of constellations like Leo over the course of a year.",YES,"Earth revolves around the Sun over the course of a year.
As Earth's position changes, different constellations become visible at different times.
This orbital motion creates the appearance that constellations shift position in the sky.","Earth's revolution around the Sun changes our perspective of the night sky.
This changing perspective makes constellations appear to move to different areas of the sky.
This orbital motion is the primary reason Leo's position changes throughout the year."
